{
 "schema": "spritemotion.skeleton",
 "schema_version": 1,
 "id": "ettin-21",
 "title": "Two-headed humanoid, 21 joints",
 "description": "humanoid-20 with two heads side by side on one neck (UO Ettin). Heads, like limbs, are labelled A and B rather than left/right; an annotation set states its identity. Head A sits on the same side as arm A.",
 "joints": [
  {
   "name": "head_A",
   "label": "Head A centre"
  },
  {
   "name": "head_B",
   "label": "Head B centre"
  },
  {
   "name": "neck",
   "label": "Neck"
  },
  {
   "name": "chest",
   "label": "Chest"
  },
  {
   "name": "pelvis",
   "label": "Pelvis"
  },
  {
   "name": "arm_A_shoulder",
   "label": "Arm A shoulder"
  },
  {
   "name": "arm_A_elbow",
   "label": "Arm A elbow"
  },
  {
   "name": "arm_A_wrist",
   "label": "Arm A wrist"
  },
  {
   "name": "arm_A_hand",
   "label": "Arm A hand"
  },
  {
   "name": "arm_B_shoulder",
   "label": "Arm B shoulder"
  },
  {
   "name": "arm_B_elbow",
   "label": "Arm B elbow"
  },
  {
   "name": "arm_B_wrist",
   "label": "Arm B wrist"
  },
  {
   "name": "arm_B_hand",
   "label": "Arm B hand"
  },
  {
   "name": "leg_A_hip",
   "label": "Leg A hip"
  },
  {
   "name": "leg_A_knee",
   "label": "Leg A knee"
  },
  {
   "name": "leg_A_ankle",
   "label": "Leg A ankle"
  },
  {
   "name": "leg_A_toe",
   "label": "Leg A toe"
  },
  {
   "name": "leg_B_hip",
   "label": "Leg B hip"
  },
  {
   "name": "leg_B_knee",
   "label": "Leg B knee"
  },
  {
   "name": "leg_B_ankle",
   "label": "Leg B ankle"
  },
  {
   "name": "leg_B_toe",
   "label": "Leg B toe"
  }
 ],
 "chains": [
  {
   "name": "spine",
   "label": "Neck / spine",
   "color": "#ffe45e",
   "joints": [
    "neck",
    "chest",
    "pelvis"
   ]
  },
  {
   "name": "head_A",
   "label": "Head A",
   "color": "#fff3a8",
   "joints": [
    "neck",
    "head_A"
   ]
  },
  {
   "name": "head_B",
   "label": "Head B",
   "color": "#ffc94d",
   "joints": [
    "neck",
    "head_B"
   ]
  },
  {
   "name": "arm_A",
   "label": "Arm A",
   "color": "#28d9ff",
   "joints": [
    "arm_A_shoulder",
    "arm_A_elbow",
    "arm_A_wrist",
    "arm_A_hand"
   ]
  },
  {
   "name": "arm_B",
   "label": "Arm B",
   "color": "#ff5edb",
   "joints": [
    "arm_B_shoulder",
    "arm_B_elbow",
    "arm_B_wrist",
    "arm_B_hand"
   ]
  },
  {
   "name": "leg_A",
   "label": "Leg A",
   "color": "#78ff6b",
   "joints": [
    "leg_A_hip",
    "leg_A_knee",
    "leg_A_ankle",
    "leg_A_toe"
   ]
  },
  {
   "name": "leg_B",
   "label": "Leg B",
   "color": "#ff9a3b",
   "joints": [
    "leg_B_hip",
    "leg_B_knee",
    "leg_B_ankle",
    "leg_B_toe"
   ]
  }
 ],
 "inferred_connections": [
  [
   "neck",
   "arm_A_shoulder"
  ],
  [
   "neck",
   "arm_B_shoulder"
  ],
  [
   "pelvis",
   "leg_A_hip"
  ],
  [
   "pelvis",
   "leg_B_hip"
  ]
 ],
 "symmetric_pairs": [
  [
   "head_A",
   "head_B"
  ],
  [
   "arm_A_shoulder",
   "arm_B_shoulder"
  ],
  [
   "arm_A_elbow",
   "arm_B_elbow"
  ],
  [
   "arm_A_wrist",
   "arm_B_wrist"
  ],
  [
   "arm_A_hand",
   "arm_B_hand"
  ],
  [
   "leg_A_hip",
   "leg_B_hip"
  ],
  [
   "leg_A_knee",
   "leg_B_knee"
  ],
  [
   "leg_A_ankle",
   "leg_B_ankle"
  ],
  [
   "leg_A_toe",
   "leg_B_toe"
  ]
 ]
}